{
  "handoff_id": "1baa9b09a4d842b28dbe5699b9955265",
  "parent_task_id": "287fb134a4a2412ca8e3ac923aa194d8",
  "subagent_name": "file_worker",
  "subtask": "Read agent.md and summarize the operating rules.",
  "context_files": [
    "agent.md",
    "skill/RUNTIME.md"
  ],
  "return_contract": {
    "expects": "delegate_result",
    "max_steps": 4
  }
}