{
  "handoff_id": "f402664f43f64db591e7c21cdc922d4c",
  "parent_task_id": "4d9d194dc73149129c4ced36f1eafa78",
  "subagent_name": "file_worker",
  "subtask": "Read agent.md and summarize the operating rules.",
  "context_files": [
    "agent.md",
    "skill/RUNTIME.md"
  ],
  "return_contract": {
    "expects": "delegate_result",
    "max_steps": 4
  }
}