{
  "handoff_id": "47327039cb6a4207836d0574a3ec8b4f",
  "parent_task_id": "c8e80b00c3814777aeed0f74972c3919",
  "subagent_name": "file_worker",
  "subtask": "Read agent.md and summarize the operating rules.",
  "context_files": [
    "agent.md",
    "skill/RUNTIME.md"
  ],
  "return_contract": {
    "expects": "delegate_result",
    "max_steps": 4
  }
}